
<ejb:comunicazioneREA xmlns:ejb="http://ejb.protocollo.infocamere.it/" xmlns:xsi="http://www.w3.org/2001/XMLSchema-instance" xsi:schemaLocation="http://ejb.protocollo.infocamere.it/ comunicazioni_rea.xsd">
	
	<soggetti>
	<!-- 
		<cognomeAddetto>pluto</cognomeAddetto>
		 -->
		<loginAddetto>login</loginAddetto>
		<nomeAddetto>pippo</nomeAddetto>
		<useridAddetto>xxxxxxx</useridAddetto>
	</soggetti>
	
	<pridPratica />
	<suapReaXml>
		<dataHandler />
	</suapReaXml>
	<suapXml>
		<dataHandler />
	</suapXml>
	<allegati>
		<allegatoDataHandler />
		<name>SUAP-ricevuta.XML</name>
		<tipo>text/xml</tipo>
	</allegati>
	<allegati>
		<allegatoDataHandler/>
		<name>SUAP-ricevuta.PDF</name>
		<tipo>application/pdf</tipo>
	</allegati>
	<allegati>
		<allegatoDataHandler />
		<name>00042270298-01062012-2514.0002.PDF.P7M</name>
		<tipo>application/pkcs7-mime</tipo>
	</allegati>
	<allegati>
		<allegatoDataHandler />
		<name>00042270298-01062012-2514.0001.MDA.PDF.P7M</name>
		<tipo>application/pkcs7-mime</tipo>
	</allegati>
	<allegati>
		<allegatoDataHandler />
		<name>00042270298-01062012-2514.0001.MDA.XML</name>
		<tipo>application/pkcs7-mime</tipo>
	</allegati>
	<allegati>
		<allegatoDataHandler />
		<name>00042270298-01062012-2514.0003.PDF</name>
		<tipo>application/pdf</tipo>
	</allegati>
	<allegati>
		<allegatoDataHandler />
		<name>00042270298-01062012-2514.0004.PDF</name>
		<tipo>application/pdf</tipo>
	</allegati>
	<visuraXML>true</visuraXML>
	<visuraPDF>false</visuraPDF>
</ejb:comunicazioneREA>